{
  "schema_version": 1,
  "plan_id": "publish_plan_4df77ec89f46c976",
  "app_id": "zhiyu_ai_hk",
  "content_plan_id": "content_plan_8b4a8acfa9f2ecaa",
  "created_at": "2026-09-11T07:51:28Z",
  "status": "complete",
  "authorized_at": "2026-09-11T07:51:43Z",
  "authorized_by": "operator",
  "authorization_id": "publish_authorization_912b59484c286b22",
  "items": [
    {
      "item_id": "publish_item_7844901663487770",
      "article_id": "article_35bb9f5ebd5f0900",
      "article_title": "知鱼是算命软件吗？先分清它在做什么",
      "body_path": "articles/social/article_35bb9f5ebd5f0900.md",
      "body_sha256": "da2c0ceba140feb3b344a550113040ab6989d3630cd9c5504e254c193969c09f",
      "channel": "social",
      "destination_id": "destination_social_manual",
      "destination_name": "知鱼已评级自媒体（人工发布）",
      "execution_mode": "manual",
      "idempotency_key": "publish_key_0b964c4d34a1131d",
      "status": "skipped",
      "attempt_count": 1,
      "latest_receipt_id": "publish_receipt_f49091e85c0daff0"
    },
    {
      "item_id": "publish_item_3a8b85e1654de7f1",
      "article_id": "article_e93407e791bb0ff7",
      "article_title": "知鱼是什么：自我认知工具，而不是算命软件",
      "body_path": "articles/media/article_e93407e791bb0ff7.md",
      "body_sha256": "3ee58ddd49611d8a81856e52e3ae5b4b9b41013cb796519c068faa17e2a34e35",
      "channel": "media",
      "destination_id": "destination_media_manual",
      "destination_name": "知鱼已评级媒体（人工/付费投放）",
      "execution_mode": "manual",
      "idempotency_key": "publish_key_f480014753c47763",
      "status": "skipped",
      "attempt_count": 1,
      "latest_receipt_id": "publish_receipt_0d04b624eb482f7e"
    }
  ]
}
